{
  "$schema": "./.claude/skills/umbrella-nuget-safe-upgrade/nuget-upgrade-exclusions.schema.json",
  "packages": [],
  "patterns": [],
  "frameworkCoupledFamilies": [
    "Microsoft.Extensions.",
    "Microsoft.AspNetCore.",
    "Microsoft.EntityFrameworkCore",
    "System.Security.Cryptography.Xml"
  ],
  "options": {
    "allowPrerelease": false
  }
}